{
  "$schema": "https://json-schema.org/draft/2020-12/schema",
  "$id": "https://example.invalid/alpha-lab/research-request-v2.schema.json",
  "title": "Alpha Lab ResearchRequest v2",
  "type": "object",
  "additionalProperties": false,
  "required": ["protocol_version", "request_id", "campaign_id", "policy_version", "campaign_policy_sha256", "start", "end", "symbols", "timeframe", "mode", "data_types", "split", "lookback_bars", "label_horizon_bars", "embargo_bars"],
  "properties": {
    "protocol_version": {"const": "2.0-research-request"},
    "request_id": {"type": "string", "pattern": "^[A-Za-z0-9][A-Za-z0-9._:-]{0,127}$"},
    "campaign_id": {"type": "string", "pattern": "^[A-Za-z0-9][A-Za-z0-9_-]{0,63}$"},
    "policy_version": {"type": "string", "pattern": "^[1-9][0-9]*$"},
    "campaign_policy_sha256": {"type": "string", "pattern": "^[0-9a-f]{64}$"},
    "start": {"$ref": "#/$defs/timestamp"},
    "end": {"$ref": "#/$defs/timestamp"},
    "symbols": {"type": "array", "minItems": 1, "uniqueItems": true, "items": {"type": "string", "minLength": 1}},
    "timeframe": {"type": "string", "minLength": 1},
    "mode": {"enum": ["time_series", "cross_sectional"]},
    "data_types": {"type": "array", "minItems": 1, "uniqueItems": true, "items": {"enum": ["futures_ohlcv", "spot_ohlcv", "funding_rate", "open_interest"]}},
    "split": {"enum": ["discovery", "validation", "holdout"]},
    "lookback_bars": {"type": "integer", "minimum": 1},
    "label_horizon_bars": {"type": "integer", "minimum": 1},
    "embargo_bars": {"type": "integer", "minimum": 0}
  },
  "$defs": {
    "timestamp": {"type": "string", "format": "date-time", "pattern": "^\\d{4}-\\d{2}-\\d{2}T\\d{2}:\\d{2}:\\d{2}(?:\\.\\d+)?(?:Z|[+-]\\d{2}:\\d{2})$"}
  }
}
